{"schema_version":"kaiba.provisioning.rpi5-release-intent/v1alpha1","release_id":"release:rpi5:1","device_class":"raspberry-pi-5-model-b-v1alpha1","source_revision":"0123456789abcdef0123456789abcdef01234567","source_date_epoch":1786968000,"unsigned_artifact_set_digest":"sha256:1111111111111111111111111111111111111111111111111111111111111111","eeprom_release_manifest_digest":"sha256:2222222222222222222222222222222222222222222222222222222222222222","public_key_fingerprint":"sha256:3333333333333333333333333333333333333333333333333333333333333333","signing_policy_digest":"sha256:4444444444444444444444444444444444444444444444444444444444444444","expected_customer_key_hash":"sha256:5555555555555555555555555555555555555555555555555555555555555555","authorization_scope":"cohort_release","signing_inputs":[{"role":"rpi5.boot_image","digest":"sha256:aaaaaaaaaaaaaaaaaaaaaaaaaaaaaaaaaaaaaaaaaaaaaaaaaaaaaaaaaaaaaaaa","size_bytes":100},{"role":"rpi5.eeprom_bootcode","digest":"sha256:bbbbbbbbbbbbbbbbbbbbbbbbbbbbbbbbbbbbbbbbbbbbbbbbbbbbbbbbbbbbbbbb","size_bytes":101},{"role":"rpi5.eeprom_bootsys","digest":"sha256:cccccccccccccccccccccccccccccccccccccccccccccccccccccccccccccccc","size_bytes":102},{"role":"rpi5.eeprom_config","digest":"sha256:dddddddddddddddddddddddddddddddddddddddddddddddddddddddddddddddd","size_bytes":103},{"role":"rpi5.owned_recovery_bootcode","digest":"sha256:eeeeeeeeeeeeeeeeeeeeeeeeeeeeeeeeeeeeeeeeeeeeeeeeeeeeeeeeeeeeeeee","size_bytes":104}],"required_output_roles":["boot_public_key","device_profile","platform_adapter","root_integrity","rpi5.boot_image","rpi5.boot_signature","rpi5.eeprom_bootsys","rpi5.eeprom_config","rpi5.fresh_commit_bundle","rpi5.fresh_readback_bundle","rpi5.negative_boot_bundle","rpi5.owned_readback_bundle","rpi5.owned_recovery_bootcode","rpi5.owned_recovery_bundle","rpi5.root_data_image","rpi5.root_hash_tree_image","rpi5.root_integrity_test_bundle","rpi5.signed_eeprom_image"]}
